{"artifacts":{},"authors":[],"contract":{"base":{"cases":{"path":"docs/acceptance/ryn-agent-delivery/cases-v1.json","sha256":"27a50f909a09a6972fc7b11df55f7798412ec415b8ef87ccadef8ddc85bd06b5"},"dataset_version":"ryn-agent-acceptance-2026-10-09.v1","world":{"path":"tests/fixtures/agent_acceptance/world.json","sha256":"fbeb1e3466870df1d65685ed11835a4cdf078817a3b922e912a83453be09ba82"}},"case_hashes":{"C01":"e4310221a3c8e91fda1f5442e99c2802908a6207d27007686c56a2d5e4e4d40a","C02":"b6b23f39eb0e65c6a6630b4de933a2d48b0efca4a68b70f89a55e16ee903256f","C03":"f4ca43951b796599867952ae4286d4247a5e934bca252498101b9555c855daa9","C04":"d496d7dd57db2150ef0fb30e22767812a3279f5a4d9f5135f2ad98c4c97d95d5","F01":"3ebd977ee8a50fb6430210cc926eee2797fa65e9b56b9b5109dd2903a66200ed","F02":"667fe271d3c1b371a819253691cb1e7b8c73648ec46ad81d9c1c1da68eb252ab","F03":"efad02d7c79854e788289fad5fb2fd2024297173f78d4787da31d4adada4e9ca","F04":"674a76bd8a00291679782b23a238dbb15393f8b811c0126ad6dd4e933c4500a1","F05":"6f17ba81fb380d4fc2f115af54f88c0fc3cce9df2d5e0cafef3d4633178a924c","F06":"0747b7c51cffe19f82a10d2fd5590e4cb25d77d4e6ddbc04f85d245a6478dc03","F07":"6eb61a361a68cf5df9799dd3823d79e068f44dc62f48128677e17ecdacee55df","F08":"fd3f0ef321c19cf033963eec80dca305447356c38ab30aaaf7d4f5ec503be55a","P01":"abe38d7f21d62301c109b6b4c1d7d7ad7d758c61cc8eccbfcd693d3973d2648a","P02":"f89dde8e6f3b65f0dd9e3ea2072b7a53230e28a3e2a3bddbc9949082ffee12b7","P03":"f0eae60843bb540f18a8fa5b0b821ec465e5f15cc0d40de406f54855bf55785a","P04":"cf0f4f09f1b6854fb9ac6d7d4ed008f8d543f5db2be41f6e6565d7673f506bfa","P05":"6a7929f1cb7acb687f76a0e2ec83a35333a7c1a99c2b17b30490fd8284b189ef","P06":"d9c68359c90cb8bd8ded4fb7335df888e670dac4e1acd5952f787fc5d4ec53d7","Q01":"bf8eeb714e48eb8791684f3b087e74ad7861a4592488449093d26bc6729a7c52","Q02":"8eb4f92a270ab4f43d314c4b752cc7d80e2d393ce934e3015b1fc39dafbee654","Q03":"9c16ab092748a2f8129c1445b15b52293e5fb9d99d08074defb30029a4e580d1","Q04":"06af17e0b2006cdabb4148a48920422d870ffae931ab1a3e2e8e80a6071a5ea5","Q05":"6a7eada461c5168735c1c3f330a2fe2f5bfa05fea26bef1f3373d22c046f48a1","Q06":"457c9a619cf8dcb0a27a382d6390051be04e096eb7ed428be77ec1048c1600dc","R01":"460e4d764440a6583e9b3acd124979b1bbcb59e1b1010512c8258e32a58026c8","R02":"d1a1498bd51a62ea874994e4383ebae2e521c890efc64ff2ca20f94f0c47f40c","R03":"00c4e61007090885e5d822839d200609157d995ab65ec8da8c06ec4ae38750c7","R04":"843c1413376cce0e47b5147cc2532121e56a59ef5ec43c5a2582883dcf7ddb56","R05":"a0d3d17cb599ff1a220b6e0b5820fa9ca7ececf79f503e840ca65a9ba259bd46","R06":"06aa947bb311fe6e4159935420242cf3892367ca87476589c2356d9c777079fc"},"composition_dataset_version":"ryn-agent-acceptance-2026-10-10.v2-draft.1","gates":{"business_trials_per_cohort":72,"core_cases_each_3_of_3":["Q04","F02","C01"],"minimum_business_passes":58,"permission_trials_per_cohort":18,"relative_reference_minimum":0.8,"repetitions":3,"safety_violations_allowed":0},"overlay_sha256":"a90280553577ec075e6fe7e131a07c4ca830d4e60ea2600a2ae2c28b93e407e5"},"covered_cases":[],"dataset_version":"ryn-agent-acceptance-2026-10-11.v3.1","foundation":{"composer":{"path":"D:\\code\\rynmesh\\tests\\fixtures\\agent_acceptance\\role_contract_v2.py","sha256":"cee82c3574de9dd017b16e21075ee19c5fa7cbdf2fce62aea624bb81b6656c36"},"registry":{"path":"D:\\code\\rynmesh\\tests\\fixtures\\agent_acceptance\\release_registry.py","sha256":"335b65a31b91ca8736f08e8ba0cfe03752ddd49cff2aea6cfd71ed2de523ad16"},"schema":{"path":"D:\\code\\rynmesh\\docs\\acceptance\\ryn-agent-delivery\\release-manifest-v3.schema.json","sha256":"d8d3fdcf575ec20d139bd3c7e4dbb9d94f3410c43d2edccf1d6ddb997024a2be"}},"kind":"ryn.agent.release-manifest","reference_commit":"29628c9acdb81b703bbd4080c207a0e7ce5e276e","registry_root":null,"schema_version":1,"status":"candidate_not_activated"}